{
  "freshness_days": 90,
  "id": "claude-code",
  "product": "Claude Code",
  "provenance": [
    {
      "kind": "official",
      "last_verified": "2026-09-15",
      "product_version": "Documentation snapshot; installed binary/version not verified",
      "status": "verified",
      "title": "Claude project memory",
      "url": "https://code.claude.com/docs/en/memory"
    },
    {
      "kind": "official",
      "last_verified": "2026-09-15",
      "product_version": "Documentation snapshot; installed binary/version not verified",
      "status": "verified",
      "title": "Claude skills and command migration",
      "url": "https://code.claude.com/docs/en/skills"
    },
    {
      "kind": "official",
      "last_verified": "2026-09-15",
      "product_version": "Documentation snapshot; installed binary/version not verified",
      "status": "verified",
      "title": "Claude subagent definitions",
      "url": "https://code.claude.com/docs/en/sub-agents"
    }
  ],
  "representations": [
    {
      "activation": [
        "automatic",
        "explicit"
      ],
      "activation_semantics": "Claude selects the defined subagent or the user requests delegation. This defines the agent, not a one-run delegation payload.",
      "authority_intents": [
        "privileged"
      ],
      "authority_semantics": "Instructions cannot override higher-priority host policy or grant runtime permissions.",
      "capabilities": {
        "agent-definition": "native",
        "approval-gates": "instruction-only",
        "named-inputs": "instruction-only",
        "privileged-instructions": "native",
        "runtime-enforcement": "unsupported"
      },
      "companion_files": [],
      "forbidden_sequences": [
        "!`"
      ],
      "id": "claude-subagent",
      "max_characters": null,
      "metadata_fields": {
        "description": "objective",
        "name": "artifact_name"
      },
      "metadata_schema": {
        "additionalProperties": false,
        "properties": {
          "description": {
            "minLength": 1,
            "type": "string"
          },
          "name": {
            "minLength": 1,
            "type": "string"
          },
          "tools": {
            "minLength": 1,
            "type": "string"
          }
        },
        "required": [
          "name",
          "description"
        ],
        "type": "object"
      },
      "metadata_values": {},
      "migration_notes": [
        "An omitted tools field inherits host tool access; body restrictions are not a sandbox. Set only verified tool identifiers after reviewing host permissions."
      ],
      "path_template": ".claude/agents/{name}.md",
      "resources": false,
      "scope_kinds": [
        "workspace"
      ],
      "scope_semantics": "The consuming host owns discovery and precedence. The body records requested scope.",
      "serializer": "frontmatter",
      "surfaces": [
        "agent"
      ],
      "unsupported_features": [],
      "validation_rules": [
        "No toolkit metadata in the native artifact.",
        "No executable interpolation of untrusted source text."
      ],
      "variables": {
        "mode": "request",
        "token": ""
      }
    }
  ],
  "schema_version": "1.0.0",
  "support_scope": "Project memory, skills, subagent definitions and task/delegation payloads.",
  "unsupported_surfaces": [
    "persistent",
    "reusable_action",
    "task",
    "delegation",
    "api",
    "runtime_policy"
  ],
  "warnings": []
}
