{
  "freshness_days": 90,
  "id": "codex",
  "product": "OpenAI Codex",
  "provenance": [
    {
      "kind": "official",
      "last_verified": "2026-09-15",
      "product_version": "Documentation snapshot; installed binary/version not verified",
      "status": "verified",
      "title": "Codex skill packaging and invocation",
      "url": "https://learn.chatgpt.com/docs/build-skills"
    },
    {
      "kind": "official",
      "last_verified": "2026-09-15",
      "product_version": "Documentation snapshot; installed binary/version not verified",
      "status": "verified",
      "title": "Codex instruction discovery",
      "url": "https://learn.chatgpt.com/docs/agent-configuration/agents-md"
    }
  ],
  "representations": [
    {
      "activation": [
        "manual",
        "model_selected"
      ],
      "activation_semantics": "Explicit invocation uses the host skill selector; manual-only sets policy.allow_implicit_invocation false in agents/openai.yaml.",
      "authority_intents": [
        "guidance"
      ],
      "authority_semantics": "Instructions cannot override higher-priority host policy or grant runtime permissions.",
      "capabilities": {
        "approval-gates": "instruction-only",
        "manual-activation": "native",
        "model-selection": "native",
        "named-inputs": "instruction-only",
        "resource-bundles": "native",
        "runtime-enforcement": "unsupported"
      },
      "companion_files": [
        {
          "format": "yaml",
          "manual_values": {
            "policy": {
              "allow_implicit_invocation": false
            }
          },
          "path": ".agents/skills/{name}/agents/openai.yaml",
          "values": {}
        }
      ],
      "forbidden_sequences": [],
      "id": "codex-skill",
      "max_characters": null,
      "metadata_fields": {
        "description": "objective",
        "name": "artifact_name"
      },
      "metadata_schema": {
        "additionalProperties": false,
        "properties": {
          "description": {
            "maxLength": 1024,
            "minLength": 1,
            "type": "string"
          },
          "name": {
            "maxLength": 64,
            "minLength": 1,
            "pattern": "^[a-z0-9]+(?:-[a-z0-9]+)*$",
            "type": "string"
          }
        },
        "required": [
          "name",
          "description"
        ],
        "type": "object"
      },
      "metadata_values": {},
      "migration_notes": [],
      "path_template": ".agents/skills/{name}/SKILL.md",
      "resources": true,
      "scope_kinds": [
        "workspace"
      ],
      "scope_semantics": "The consuming host owns discovery and precedence. The body records requested scope.",
      "serializer": "frontmatter",
      "surfaces": [
        "reusable_action"
      ],
      "unsupported_features": [],
      "validation_rules": [
        "No toolkit metadata in the native artifact.",
        "No executable interpolation of untrusted source text."
      ],
      "variables": {
        "mode": "request",
        "token": ""
      }
    }
  ],
  "schema_version": "1.0.0",
  "support_scope": "Project instructions, project skills, task/delegation text. Native agent configuration is outside this implemented subset.",
  "unsupported_surfaces": [
    "persistent",
    "agent",
    "task",
    "delegation",
    "api",
    "runtime_policy"
  ],
  "warnings": []
}
