{
  "freshness_days": 90,
  "id": "codex",
  "product": "OpenAI Codex",
  "provenance": [
    {
      "kind": "official",
      "last_verified": "2026-09-15",
      "product_version": "Documentation snapshot; installed binary/version not verified",
      "status": "verified",
      "title": "Codex skill packaging and invocation",
      "url": "https://learn.chatgpt.com/docs/build-skills"
    },
    {
      "kind": "official",
      "last_verified": "2026-09-15",
      "product_version": "Documentation snapshot; installed binary/version not verified",
      "status": "verified",
      "title": "Codex instruction discovery",
      "url": "https://learn.chatgpt.com/docs/agent-configuration/agents-md"
    }
  ],
  "representations": [
    {
      "activation": [
        "automatic"
      ],
      "activation_semantics": "Read before work according to Codex project traversal.",
      "authority_intents": [
        "guidance"
      ],
      "authority_semantics": "Instructions cannot override higher-priority host policy or grant runtime permissions.",
      "capabilities": {
        "approval-gates": "instruction-only",
        "named-inputs": "instruction-only",
        "persistent-context": "native",
        "runtime-enforcement": "unsupported",
        "scoped-instructions": "native"
      },
      "companion_files": [],
      "forbidden_sequences": [],
      "id": "codex-instructions",
      "max_characters": null,
      "metadata_fields": {},
      "metadata_schema": {
        "additionalProperties": false,
        "properties": {},
        "required": [],
        "type": "object"
      },
      "metadata_values": {},
      "migration_notes": [
        "Legacy custom prompt mechanisms are not emitted. Prefer the documented skill representation."
      ],
      "path_template": "{scope}/AGENTS.md",
      "resources": false,
      "scope_kinds": [
        "workspace",
        "paths"
      ],
      "scope_semantics": "Codex walks project root to current working directory. At most one file per directory: AGENTS.override.md, then AGENTS.md, then configured fallbacks. Inspect overrides before installing.",
      "serializer": "markdown",
      "surfaces": [
        "persistent"
      ],
      "unsupported_features": [],
      "validation_rules": [
        "No toolkit metadata in the native artifact.",
        "No executable interpolation of untrusted source text."
      ],
      "variables": {
        "mode": "request",
        "token": ""
      }
    }
  ],
  "schema_version": "1.0.0",
  "support_scope": "Project instructions, project skills, task/delegation text. Native agent configuration is outside this implemented subset.",
  "unsupported_surfaces": [
    "reusable_action",
    "agent",
    "task",
    "delegation",
    "api",
    "runtime_policy"
  ],
  "warnings": []
}
