{
  "freshness_days": 90,
  "id": "gemini-cli",
  "product": "Gemini CLI",
  "provenance": [
    {
      "kind": "official",
      "last_verified": "2026-09-15",
      "product_version": "Documentation snapshot; installed binary/version not verified",
      "status": "verified",
      "title": "Gemini project context",
      "url": "https://geminicli.com/docs/cli/gemini-md/"
    },
    {
      "kind": "official",
      "last_verified": "2026-09-15",
      "product_version": "Documentation snapshot; installed binary/version not verified",
      "status": "verified",
      "title": "Gemini custom commands",
      "url": "https://geminicli.com/docs/cli/custom-commands/"
    },
    {
      "kind": "official",
      "last_verified": "2026-09-15",
      "product_version": "Documentation snapshot; installed binary/version not verified",
      "status": "verified",
      "title": "Gemini Agent Skills",
      "url": "https://geminicli.com/docs/cli/skills/"
    }
  ],
  "representations": [
    {
      "activation": [
        "manual"
      ],
      "activation_semantics": "Manual slash command. TOML prompt is required; description is optional. Project commands override same-named user commands.",
      "authority_intents": [
        "guidance"
      ],
      "authority_semantics": "Instructions cannot override higher-priority host policy or grant runtime permissions.",
      "capabilities": {
        "approval-gates": "instruction-only",
        "manual-activation": "native",
        "named-inputs": "instruction-only",
        "runtime-enforcement": "unsupported"
      },
      "companion_files": [],
      "forbidden_sequences": [
        "!{",
        "@{"
      ],
      "id": "gemini-command",
      "max_characters": null,
      "metadata_fields": {
        "description": "objective"
      },
      "metadata_schema": {
        "additionalProperties": false,
        "properties": {
          "description": {
            "minLength": 1,
            "type": "string"
          },
          "prompt": {
            "minLength": 1,
            "type": "string"
          }
        },
        "required": [
          "prompt"
        ],
        "type": "object"
      },
      "metadata_values": {},
      "migration_notes": [
        "Named input schemas cannot be enforced by the aggregate args token. Executable shell/file interpolation is deliberately not generated."
      ],
      "path_template": ".gemini/commands/{name}.toml",
      "resources": false,
      "scope_kinds": [
        "workspace"
      ],
      "scope_semantics": "The consuming host owns discovery and precedence. The body records requested scope.",
      "serializer": "toml-command",
      "surfaces": [
        "reusable_action"
      ],
      "unsupported_features": [],
      "validation_rules": [
        "No toolkit metadata in the native artifact.",
        "No executable interpolation of untrusted source text."
      ],
      "variables": {
        "mode": "aggregate",
        "token": "{{args}}"
      }
    },
    {
      "activation": [
        "model_selected"
      ],
      "activation_semantics": "The host discovers the name and description; the body and resources load on selection.",
      "authority_intents": [
        "guidance"
      ],
      "authority_semantics": "Instructions cannot override higher-priority host policy or grant runtime permissions.",
      "capabilities": {
        "approval-gates": "instruction-only",
        "model-selection": "native",
        "named-inputs": "instruction-only",
        "resource-bundles": "native",
        "runtime-enforcement": "unsupported"
      },
      "companion_files": [],
      "forbidden_sequences": [],
      "id": "gemini-skill",
      "max_characters": null,
      "metadata_fields": {
        "description": "objective",
        "name": "artifact_name"
      },
      "metadata_schema": {
        "additionalProperties": false,
        "properties": {
          "description": {
            "maxLength": 1024,
            "minLength": 1,
            "type": "string"
          },
          "name": {
            "maxLength": 64,
            "minLength": 1,
            "pattern": "^[a-z0-9]+(?:-[a-z0-9]+)*$",
            "type": "string"
          }
        },
        "required": [
          "name",
          "description"
        ],
        "type": "object"
      },
      "metadata_values": {},
      "migration_notes": [],
      "path_template": ".gemini/skills/{name}/SKILL.md",
      "resources": true,
      "scope_kinds": [
        "workspace"
      ],
      "scope_semantics": "The consuming host owns discovery and precedence. The body records requested scope.",
      "serializer": "frontmatter",
      "surfaces": [
        "reusable_action"
      ],
      "unsupported_features": [],
      "validation_rules": [
        "No toolkit metadata in the native artifact.",
        "No executable interpolation of untrusted source text."
      ],
      "variables": {
        "mode": "request",
        "token": ""
      }
    }
  ],
  "schema_version": "1.0.0",
  "support_scope": "Project context, TOML manual commands, model-selectable skills, text task/delegation payloads.",
  "unsupported_surfaces": [
    "persistent",
    "agent",
    "task",
    "delegation",
    "api",
    "runtime_policy"
  ],
  "warnings": []
}
