{
  "freshness_days": 90,
  "id": "cursor",
  "product": "Cursor",
  "provenance": [
    {
      "kind": "official",
      "last_verified": "2026-09-15",
      "product_version": "Documentation snapshot; installed binary/version not verified",
      "status": "verified",
      "title": "Cursor project rules",
      "url": "https://cursor.com/docs/rules"
    },
    {
      "kind": "official",
      "last_verified": "2026-09-15",
      "product_version": "Documentation snapshot; installed binary/version not verified",
      "representation_ids": [
        "cursor-command"
      ],
      "status": "unverified",
      "title": "Legacy Cursor project commands: current command-format provenance requires reverification",
      "url": "https://docs.cursor.com/en/agent/chat/commands"
    }
  ],
  "representations": [
    {
      "activation": [
        "explicit"
      ],
      "activation_semantics": "Explicit use by the caller; no automatic invocation is promised.",
      "authority_intents": [
        "delegated"
      ],
      "authority_semantics": "Instructions cannot override higher-priority host policy or grant runtime permissions.",
      "capabilities": {
        "approval-gates": "instruction-only",
        "delegation-contract": "native",
        "named-inputs": "instruction-only",
        "runtime-enforcement": "unsupported"
      },
      "companion_files": [],
      "forbidden_sequences": [],
      "id": "delegation-message",
      "max_characters": null,
      "metadata_fields": {},
      "metadata_schema": {
        "additionalProperties": false,
        "properties": {},
        "required": [],
        "type": "object"
      },
      "metadata_values": {},
      "migration_notes": [],
      "path_template": "{name}.md",
      "resources": false,
      "scope_kinds": [
        "request",
        "session",
        "paths"
      ],
      "scope_semantics": "The consuming host owns discovery and precedence. The body records requested scope.",
      "serializer": "markdown",
      "surfaces": [
        "delegation"
      ],
      "unsupported_features": [],
      "validation_rules": [
        "No toolkit metadata in the native artifact.",
        "No executable interpolation of untrusted source text."
      ],
      "variables": {
        "mode": "request",
        "token": ""
      }
    }
  ],
  "schema_version": "2.0.0",
  "support_scope": "Project rules and task/delegation text; legacy project command projection retained provisionally, not currently verified for host execution.",
  "unsupported_surfaces": [
    "persistent",
    "reusable_action",
    "agent",
    "task",
    "api",
    "runtime_policy"
  ],
  "warnings": [
    "Cursor command documentation is mutable; verify the installed host before deployment."
  ]
}
