{
  "freshness_days": 90,
  "id": "claude-code",
  "product": "Claude Code",
  "provenance": [
    {
      "kind": "official",
      "last_verified": "2026-09-15",
      "product_version": "Documentation snapshot; installed binary/version not verified",
      "status": "verified",
      "title": "Claude project memory",
      "url": "https://code.claude.com/docs/en/memory"
    },
    {
      "kind": "official",
      "last_verified": "2026-09-15",
      "product_version": "Documentation snapshot; installed binary/version not verified",
      "status": "verified",
      "title": "Claude skills and command migration",
      "url": "https://code.claude.com/docs/en/skills"
    },
    {
      "kind": "official",
      "last_verified": "2026-09-15",
      "product_version": "Documentation snapshot; installed binary/version not verified",
      "status": "verified",
      "title": "Claude subagent definitions",
      "url": "https://code.claude.com/docs/en/sub-agents"
    }
  ],
  "representations": [
    {
      "activation": [
        "automatic"
      ],
      "activation_semantics": "Project memory uses CLAUDE.md; load/import semantics belong to Claude Code.",
      "authority_intents": [
        "guidance"
      ],
      "authority_semantics": "Instructions cannot override higher-priority host policy or grant runtime permissions.",
      "capabilities": {
        "approval-gates": "instruction-only",
        "named-inputs": "instruction-only",
        "persistent-context": "native",
        "runtime-enforcement": "unsupported",
        "scoped-instructions": "native"
      },
      "companion_files": [],
      "forbidden_sequences": [],
      "id": "claude-memory",
      "max_characters": null,
      "metadata_fields": {},
      "metadata_schema": {
        "additionalProperties": false,
        "properties": {},
        "required": [],
        "type": "object"
      },
      "metadata_values": {},
      "migration_notes": [],
      "path_template": "{scope}/CLAUDE.md",
      "resources": false,
      "scope_kinds": [
        "workspace",
        "paths"
      ],
      "scope_semantics": "Parent memory is loaded; nested files are discovered as work reaches them. Verify import paths and keep critical boundaries reachable.",
      "serializer": "markdown",
      "surfaces": [
        "persistent"
      ],
      "unsupported_features": [],
      "validation_rules": [
        "No toolkit metadata in the native artifact.",
        "No executable interpolation of untrusted source text."
      ],
      "variables": {
        "mode": "request",
        "token": ""
      }
    }
  ],
  "schema_version": "1.0.0",
  "support_scope": "Project memory, skills, subagent definitions and task/delegation payloads.",
  "unsupported_surfaces": [
    "reusable_action",
    "agent",
    "task",
    "delegation",
    "api",
    "runtime_policy"
  ],
  "warnings": []
}
