{
  "freshness_days": 90,
  "id": "agents-md",
  "product": "AGENTS.md",
  "provenance": [
    {
      "kind": "official",
      "last_verified": "2026-09-15",
      "product_version": "Documentation snapshot; installed binary/version not verified",
      "status": "verified",
      "title": "AGENTS.md public guidance",
      "url": "https://agents.md/"
    }
  ],
  "representations": [
    {
      "activation": [
        "automatic"
      ],
      "activation_semantics": "Project instructions discovered by a compatible host; actual traversal and overrides are host-specific.",
      "authority_intents": [
        "guidance"
      ],
      "authority_semantics": "Instructions cannot override higher-priority host policy or grant runtime permissions.",
      "capabilities": {
        "approval-gates": "instruction-only",
        "named-inputs": "instruction-only",
        "persistent-context": "native",
        "runtime-enforcement": "unsupported",
        "scoped-instructions": "native"
      },
      "companion_files": [],
      "forbidden_sequences": [],
      "id": "agents-md",
      "max_characters": null,
      "metadata_fields": {},
      "metadata_schema": {
        "additionalProperties": false,
        "properties": {},
        "required": [],
        "type": "object"
      },
      "metadata_values": {},
      "migration_notes": [
        "Emit ordinary Markdown. No required YAML metadata. Preserve security boundaries when reducing length."
      ],
      "path_template": "{scope}/AGENTS.md",
      "resources": false,
      "scope_kinds": [
        "workspace",
        "paths"
      ],
      "scope_semantics": "Root or scoped directory. Do not generalize one host traversal algorithm to all consumers.",
      "serializer": "markdown",
      "surfaces": [
        "persistent"
      ],
      "unsupported_features": [],
      "validation_rules": [
        "No toolkit metadata in the native artifact.",
        "No executable interpolation of untrusted source text."
      ],
      "variables": {
        "mode": "request",
        "token": ""
      }
    }
  ],
  "schema_version": "1.0.0",
  "support_scope": "Plain Markdown project instructions, not a universal host discovery implementation.",
  "unsupported_surfaces": [
    "reusable_action",
    "agent",
    "task",
    "delegation",
    "api",
    "runtime_policy"
  ],
  "warnings": []
}
