{
  "freshness_days": 90,
  "id": "github-copilot",
  "product": "GitHub Copilot in VS Code",
  "provenance": [
    {
      "kind": "official",
      "last_verified": "2026-09-15",
      "product_version": "Documentation snapshot; installed binary/version not verified",
      "status": "verified",
      "title": "VS Code custom instructions",
      "url": "https://code.visualstudio.com/docs/agent-customization/custom-instructions"
    },
    {
      "kind": "official",
      "last_verified": "2026-09-15",
      "product_version": "Documentation snapshot; installed binary/version not verified",
      "status": "verified",
      "title": "VS Code prompt files",
      "url": "https://code.visualstudio.com/docs/agent-customization/prompt-files"
    },
    {
      "kind": "official",
      "last_verified": "2026-09-15",
      "product_version": "Documentation snapshot; installed binary/version not verified",
      "status": "verified",
      "title": "VS Code custom agents",
      "url": "https://code.visualstudio.com/docs/agent-customization/custom-agents"
    }
  ],
  "representations": [
    {
      "activation": [
        "explicit"
      ],
      "activation_semantics": "Explicit use by the caller; no automatic invocation is promised.",
      "authority_intents": [
        "delegated"
      ],
      "authority_semantics": "Instructions cannot override higher-priority host policy or grant runtime permissions.",
      "capabilities": {
        "approval-gates": "instruction-only",
        "delegation-contract": "native",
        "named-inputs": "instruction-only",
        "runtime-enforcement": "unsupported"
      },
      "companion_files": [],
      "forbidden_sequences": [],
      "id": "delegation-message",
      "max_characters": null,
      "metadata_fields": {},
      "metadata_schema": {
        "additionalProperties": false,
        "properties": {},
        "required": [],
        "type": "object"
      },
      "metadata_values": {},
      "migration_notes": [],
      "path_template": "{name}.md",
      "resources": false,
      "scope_kinds": [
        "request",
        "session",
        "paths"
      ],
      "scope_semantics": "The consuming host owns discovery and precedence. The body records requested scope.",
      "serializer": "markdown",
      "surfaces": [
        "delegation"
      ],
      "unsupported_features": [],
      "validation_rules": [
        "No toolkit metadata in the native artifact.",
        "No executable interpolation of untrusted source text."
      ],
      "variables": {
        "mode": "request",
        "token": ""
      }
    }
  ],
  "schema_version": "1.0.0",
  "support_scope": "VS Code only, not GitHub.com or every Copilot surface.",
  "unsupported_surfaces": [
    "persistent",
    "reusable_action",
    "agent",
    "task",
    "api",
    "runtime_policy"
  ],
  "warnings": [
    "The github-copilot adapter targets the VS Code variant; verify compatibility for other Copilot products."
  ]
}
